[
  {
    "issue_id": "ISSUE-001",
    "social_context": {
      "zh": "日本的高龄化不只是护理设施不足的问题。独居、近邻关系变弱、买菜和通院距离增加，会让老人越来越难在熟悉的社区里维持日常生活。",
      "ja": "日本の高齢化は、介護施設の不足だけではありません。独居、近隣関係の弱まり、買い物や通院の距離が重なることで、住み慣れた地域で日常を続けにくくなります。"
    },
    "why_architecture": {
      "zh": "建筑不能解决老龄化本身，但可以把吃饭、休息、见守、咨询、轻护理这些分散的支持放回日常动线里。",
      "ja": "建築は高齢化そのものを解決できませんが、食事、休憩、見守り、相談、軽いケアを日常動線の中へ戻すことができます。"
    },
    "spatial_problem": {
      "zh": "问题常出现在团地低层、商店街边缘、车站周边、公共设施之间的空白地带：有空间，却缺少低门槛、可持续运营的停留理由。",
      "ja": "団地の低層部、商店街の端部、駅周辺、公共施設のあいだにある余白で起こりやすい問題です。空間はあっても、低いハードルで立ち寄れる理由と運営が不足しています。"
    },
    "architecture_can_do": {
      "zh": ["把食堂、休息、咨询、健康确认做成一个日常节点", "设计途中休息、厕所、日阴和见守的连续网络", "让护理空间不被孤立成机构，而是嵌入社区公共生活"],
      "ja": ["食堂、休憩、相談、健康確認を一つの日常拠点に重ねる", "途中休憩、トイレ、日陰、見守りを連続するネットワークとして考える", "ケアを施設内に閉じず、地域の公共生活へ埋め込む"]
    },
    "architecture_cannot_do": {
      "zh": "建筑不能替代护理制度、医疗人手和家庭支持；设计重点应放在降低求助门槛和增加日常接点。",
      "ja": "建築は介護制度、医療人材、家族支援の代わりにはなりません。設計の焦点は、助けを求める入口を低くし、日常的な接点を増やすことです。"
    },
    "site_clues": {
      "zh": ["高龄化明显的团地或住宅地", "老商店街与公共设施之间", "车站、诊所、药局、超市之间的步行动线"],
      "ja": ["高齢化が進む団地や住宅地", "古い商店街と公共施設のあいだ", "駅、診療所、薬局、スーパーを結ぶ歩行動線"]
    },
    "starter_questions": {
      "zh": ["老人为什么不愿意或不能出门？", "哪些日常服务可以被合并成一个轻量据点？", "如何让护理空间看起来不像必须被照顾的人才会去的地方？"],
      "ja": ["高齢者はなぜ外出しにくくなるのか？", "どの生活サービスを小さな拠点に重ねられるか？", "ケアの場所を、支援を受ける人だけの施設に見せないためには何が必要か？"]
    },
    "evidence_urls": ["https://www8.cao.go.jp/kourei/", "https://www8.cao.go.jp/kourei/english/annualreport/2025/pdf/2025.pdf", "https://www.mhlw.go.jp/"]
  },
  {
    "issue_id": "ISSUE-002",
    "social_context": {
      "zh": "日本空屋增加与人口减少、继承、地方衰退和住宅市场错位有关。空屋不是单纯的房产问题，也会影响防灾、景观、社区安全和地方服务。",
      "ja": "空き家の増加は、人口減少、相続、地域衰退、住宅市場のずれと関係しています。空き家は不動産だけの問題ではなく、防災、景観、防犯、地域サービスにも影響します。"
    },
    "why_architecture": {
      "zh": "建筑可以把空屋从“闲置资产”重新定义为短住、工坊、公共厨房、咨询、展示或小商业的启动空间。",
      "ja": "建築は空き家を「余った不動産」ではなく、短期滞在、工房、公共キッチン、相談、展示、小商いの起点として読み替えられます。"
    },
    "spatial_problem": {
      "zh": "空屋往往分散、尺度小、产权复杂。毕业设计不应只做单体改修，而要思考多个小空间如何组成社区服务网络。",
      "ja": "空き家は分散し、小さく、権利関係も複雑です。卒業設計では単体改修だけでなく、複数の小さな空間が地域サービスのネットワークになる方法を考えたいところです。"
    },
    "architecture_can_do": {
      "zh": ["用低成本改修建立试验性公共功能", "把住宿、制作、饮食和地方服务混合", "保留既有建筑记忆，同时降低新活动进入成本"],
      "ja": ["低コスト改修で実験的な公共機能を立ち上げる", "宿泊、制作、食、地域サービスを混ぜる", "既存建物の記憶を残しながら、新しい活動の参入コストを下げる"]
    },
    "architecture_cannot_do": {
      "zh": "建筑不能单独解决产权、税制和人口流出；设计需要把运营主体、改修成本和使用频度一起考虑。",
      "ja": "建築だけで権利、税制、人口流出は解決できません。運営主体、改修費、利用頻度まで含めて考える必要があります。"
    },
    "site_clues": {
      "zh": ["地方旧市街的空屋群", "观光地与居民区交界", "车站或港口附近的小型闲置建筑"],
      "ja": ["地方旧市街の空き家群", "観光地と住民生活の境界", "駅や港に近い小さな遊休建物"]
    },
    "starter_questions": {
      "zh": ["哪些空屋适合被公共化，哪些不适合？", "单个空屋如何连接成街区层面的活动网络？", "改修后的空间由谁运营、谁受益？"],
      "ja": ["どの空き家は公共化でき、どの空き家は向かないのか？", "一つの空き家を街区レベルの活動ネットワークへどう接続するか？", "改修後の場所は誰が運営し、誰が使うのか？"]
    },
    "evidence_urls": ["https://www.stat.go.jp/english/data/jyutaku/index.html", "https://www.e-stat.go.jp/en/stat-search/database?toukei=00200522&tstat=000001207800", "https://www.mlit.go.jp/"]
  },
  {
    "issue_id": "ISSUE-003",
    "social_context": {
      "zh": "儿童放学后的时间夹在学校、家庭和地域之间。双职工、少子化、社区关系变弱，使孩子的学习、游戏、等待和被看见的场所变得不足。",
      "ja": "放課後の時間は、学校、家庭、地域のあいだにあります。共働き、少子化、地域関係の弱まりによって、学ぶ、遊ぶ、待つ、見守られる場所が不足しやすくなっています。"
    },
    "why_architecture": {
      "zh": "建筑可以把托管、学习、阅读、游戏和邻里见守组合在一个非学校化的日常空间里。",
      "ja": "建築は預かり、学習、読書、遊び、地域の見守りを、学校らしすぎない日常空間として組み合わせられます。"
    },
    "spatial_problem": {
      "zh": "如果只是做儿童中心，容易变成封闭设施。更有价值的问题是：孩子在回家路上、图书馆周边、公园边缘和商店街里如何安全停留。",
      "ja": "単なる児童施設にすると閉じた場所になりがちです。重要なのは、帰宅動線、図書館周辺、公園の端、商店街の中で子どもが安全に滞在できることです。"
    },
    "architecture_can_do": {
      "zh": ["创造学校外的小型学习客厅", "让儿童活动与成人视线、商店街、图书馆自然重叠", "设计可玩、可读、可等候、可咨询的混合空间"],
      "ja": ["学校外の小さな学習リビングをつくる", "子どもの活動を大人の視線、商店街、図書館と自然に重ねる", "遊べる、読める、待てる、相談できる混合空間を設計する"]
    },
    "architecture_cannot_do": {
      "zh": "建筑不能替代儿童福利、人手配置和家庭支持；它能做的是让支援更容易被遇见。",
      "ja": "建築は児童福祉、人員配置、家庭支援の代わりにはなりません。できるのは、支援に出会いやすい環境をつくることです。"
    },
    "site_clues": {
      "zh": ["小学到车站、住宅地之间的动线", "图书馆、公园、商店街边缘", "学校外但儿童日常会经过的位置"],
      "ja": ["小学校から駅・住宅地への動線", "図書館、公園、商店街の端部", "学校外だが子どもが日常的に通る場所"]
    },
    "starter_questions": {
      "zh": ["孩子真正需要的是托管、学习、游戏还是被看见？", "如何避免空间被过度管理？", "家长和地域居民如何自然参与？"],
      "ja": ["子どもに必要なのは預かり、学習、遊び、見守りのどれか？", "管理されすぎない場所にするには？", "保護者や地域住民はどう自然に関われるか？"]
    },
    "evidence_urls": ["https://www.cfa.go.jp/en/index-en", "https://www.cfa.go.jp/"]
  },
  {
    "issue_id": "ISSUE-004",
    "social_context": {
      "zh": "商店街衰退不只是店铺减少。它意味着居民步行理由、偶然交流、日常采购和地方身份一起变弱。",
      "ja": "商店街の衰退は、店舗数の減少だけではありません。歩く理由、偶然の交流、日常の買い物、地域らしさが同時に弱まることです。"
    },
    "why_architecture": {
      "zh": "建筑可以把空店铺、路地、骑楼、广场和公共服务重新组织，让商店街从消费空间变回日常公共空间。",
      "ja": "建築は空き店舗、路地、アーケード、広場、公共サービスを再編集し、商店街を消費だけの場所から日常の公共空間へ戻せます。"
    },
    "spatial_problem": {
      "zh": "问题不只是空店本身，而是整条街缺少连续活动和停留密度。毕业设计可以把小商业、休息、咨询、食、活动做成连续界面。",
      "ja": "問題は空き店舗単体ではなく、通り全体の活動と滞在密度が落ちることです。小商い、休憩、相談、食、イベントを連続する界面として設計できます。"
    },
    "architecture_can_do": {
      "zh": ["把空店铺转成小型公共服务和试营空间", "恢复步行中的停留点、坐下点和可见活动", "让市场、行政、食、照护等功能混合进街道"],
      "ja": ["空き店舗を小さな公共サービスや試行的な店舗に変える", "歩行中の滞在点、座る場所、見える活動を回復する", "市場、行政、食、ケアを通りへ混ぜる"]
    },
    "architecture_cannot_do": {
      "zh": "建筑不能保证商业繁荣；如果没有运营、租金和参与者机制，空间会再次空置。",
      "ja": "建築だけで商業の繁栄は保証できません。運営、家賃、参加者の仕組みがなければ再び空洞化します。"
    },
    "site_clues": {
      "zh": ["空店铺连续出现的商店街", "车站前但停留弱的街道", "老市场、公共设施与小商业交界处"],
      "ja": ["空き店舗が連続する商店街", "駅前だが滞在が弱い通り", "古い市場、公共施設、小商いの境界"]
    },
    "starter_questions": {
      "zh": ["这条街缺的是店，还是缺少停留理由？", "哪些公共服务可以进入商店街？", "如何让居民和小商家都能低成本参与？"],
      "ja": ["足りないのは店舗か、それとも滞在理由か？", "どの公共サービスを商店街に入れられるか？", "住民と小商いが低コストで参加するには？"]
    },
    "evidence_urls": ["https://www.chusho.meti.go.jp/shogyo/shogyo/shotengai_chousa.html", "https://www.chusho.meti.go.jp/shogyo/shogyo/2022/220408shoutengai.html"]
  },
  {
    "issue_id": "ISSUE-005",
    "social_context": {
      "zh": "少子化和人口移动让许多学校关闭。廃校不仅是闲置建筑，也是地方记忆、避难、体育、学习和交流的潜在公共资产。",
      "ja": "少子化や人口移動によって、多くの学校が閉校しています。廃校は遊休建物であると同時に、地域の記憶、避難、体育、学習、交流の公共資産になり得ます。"
    },
    "why_architecture": {
      "zh": "学校建筑有清晰的教室、走廊、操场和体育馆尺度，适合被重新组合成地域学习、制作、避难和世代交流空间。",
      "ja": "学校建築には教室、廊下、校庭、体育館という明確なスケールがあり、地域学習、制作、避難、世代交流へ再編集しやすい特徴があります。"
    },
    "spatial_problem": {
      "zh": "廃校改修容易变成单一展览或活动设施。更重要的是让它重新成为地方日常的一部分，而不是偶尔开放的纪念建筑。",
      "ja": "廃校改修は展示施設やイベント施設に偏りがちです。重要なのは、記念的な建物ではなく地域の日常へ戻すことです。"
    },
    "architecture_can_do": {
      "zh": ["把教室转成学习、工房、咨询和小型办公室", "让体育馆和操场承担平时活动与灾时避难", "保留学校记忆，同时导入新的地域运营"],
      "ja": ["教室を学習、工房、相談、小さなオフィスへ転用する", "体育館と校庭を平常時活動と災害時避難の両方に使う", "学校の記憶を残しながら新しい地域運営を入れる"]
    },
    "architecture_cannot_do": {
      "zh": "建筑不能凭怀旧维持运营；需要明确谁每天使用、谁管理、谁承担维护。",
      "ja": "建築は懐かしさだけでは運営を維持できません。誰が日常的に使い、管理し、維持するかが必要です。"
    },
    "site_clues": {
      "zh": ["地方或郊外的廃校", "缺少公共学习空间的住宅地", "可兼作防灾据点的学校遗产"],
      "ja": ["地方や郊外の廃校", "公共的な学習空間が少ない住宅地", "防災拠点にもなり得る学校跡"]
    },
    "starter_questions": {
      "zh": ["这所学校的空间记忆应该保留到什么程度？", "平时使用和灾时使用如何切换？", "哪些新功能能让它每天被使用？"],
      "ja": ["学校の記憶をどこまで残すか？", "平常時利用と災害時利用をどう切り替えるか？", "毎日使われるためにどんな機能が必要か？"]
    },
    "evidence_urls": ["https://www.mext.go.jp/a_menu/shotou/zyosei/yoyuu_00002.htm", "https://www.mext.go.jp/a_menu/shotou/zyosei/1296809.htm"]
  },
  {
    "issue_id": "ISSUE-006",
    "social_context": {
      "zh": "日本许多团地同时面临建筑老化、居民高龄化、空室和生活服务不足。问题不是单纯更新住宅，而是重新组织生活支持。",
      "ja": "多くの団地では、建物の老朽化、居住者の高齢化、空室、生活サービス不足が重なっています。課題は住宅更新だけでなく、生活支援の再配置です。"
    },
    "why_architecture": {
      "zh": "建筑可以利用低层部、集会所、空地和步行动线，把食、育儿、护理、移动支援和共同活动放近居民。",
      "ja": "建築は低層部、集会所、空地、歩行動線を使い、食、子育て、ケア、移動支援、共同活動を住民の近くへ置けます。"
    },
    "spatial_problem": {
      "zh": "团地的公共空间常常存在但不活跃。毕业设计可以研究如何把空地从景观余白变成服务和交流基础设施。",
      "ja": "団地には公共的な空間があっても、活動が弱いことが多いです。空地を景観の余白ではなく、サービスと交流の基盤に変えることができます。"
    },
    "architecture_can_do": {
      "zh": ["更新低层部和集会所为生活服务节点", "增加多代共同使用的厨房、工房、看护和学习空间", "把步行休息、配送、移动支援纳入团地内部"],
      "ja": ["低層部や集会所を生活サービス拠点へ更新する", "多世代で使うキッチン、工房、ケア、学習空間を入れる", "歩行休憩、配送、移動支援を団地内に組み込む"]
    },
    "architecture_cannot_do": {
      "zh": "建筑不能只靠漂亮公共空间解决居民关系；需要处理运营、租户构成、服务供给和长期维护。",
      "ja": "きれいな共用空間だけでは住民関係は改善しません。運営、居住者構成、サービス供給、維持管理まで見る必要があります。"
    },
    "site_clues": {
      "zh": ["老旧大规模团地", "有空地但活动少的住宅区", "公共交通弱化的郊外住宅地"],
      "ja": ["老朽化した大規模団地", "空地はあるが活動が少ない住宅地", "公共交通が弱い郊外住宅地"]
    },
    "starter_questions": {
      "zh": ["团地中最缺的是住宅、服务还是关系？", "低层部可以承担哪些公共功能？", "如何让年轻家庭与高龄居民同时受益？"],
      "ja": ["団地に足りないのは住宅、サービス、関係のどれか？", "低層部にどんな公共機能を置けるか？", "若い世帯と高齢者が同時に使える場所とは？"]
    },
    "evidence_urls": ["https://www8.cao.go.jp/kourei/", "https://www.mlit.go.jp/toshi/toshi_tk1_000016.html"]
  },
  {
    "issue_id": "ISSUE-007",
    "social_context": {
      "zh": "日本的水害、地震和极端天气让防灾不再只是灾时问题。水边空间需要同时承担日常散步、环境学习和风险理解。",
      "ja": "水害、地震、極端気象により、防災は災害時だけの問題ではなくなっています。水辺空間は日常散歩、環境学習、リスク理解を同時に担う必要があります。"
    },
    "why_architecture": {
      "zh": "建筑和景观可以把水位、地形、避难路径、生态和休憩转成可被身体理解的公共空间。",
      "ja": "建築とランドスケープは、水位、地形、避難経路、生態、休憩を身体で理解できる公共空間へ変換できます。"
    },
    "spatial_problem": {
      "zh": "很多防灾设施平时难以被使用，水边也常被栏杆和高差隔离。设计需要把风险教育做成日常体验。",
      "ja": "防災施設は平常時に使われにくく、水辺も柵や高低差で切り離されがちです。リスク教育を日常体験にする必要があります。"
    },
    "architecture_can_do": {
      "zh": ["设计可感知水位变化的步道、平台和标识", "把避难动线和日常散步动线重合", "结合生态观察、雨水管理和儿童学习"],
      "ja": ["水位変化を感じられる歩道、デッキ、サインを設計する", "避難動線と日常の散歩動線を重ねる", "生態観察、雨水管理、子どもの学習を組み合わせる"]
    },
    "architecture_cannot_do": {
      "zh": "建筑不能阻止灾害发生；它能做的是提高日常认知、避难熟悉度和空间韧性。",
      "ja": "建築は災害そのものを止められません。できるのは、日常的な理解、避難への慣れ、空間のレジリエンスを高めることです。"
    },
    "site_clues": {
      "zh": ["小河川、运河、低地公园", "洪水风险区域中的公共设施", "学校或住宅地附近的水边"],
      "ja": ["小河川、運河、低地の公園", "浸水リスクのある公共施設周辺", "学校や住宅地に近い水辺"]
    },
    "starter_questions": {
      "zh": ["人如何在平时理解水位和地形？", "避难路线能否成为日常散步路线？", "水边如何同时安全、亲近、有教育性？"],
      "ja": ["人は平常時に水位や地形をどう理解できるか？", "避難経路を日常の散歩道にできるか？", "水辺を安全で近く、学べる場所にするには？"]
    },
    "evidence_urls": ["https://www.bousai.go.jp/index-e.html", "https://www.mlit.go.jp/river/"]
  },
  {